1424589724,220127 1325,220225 1223,2750.00,2750.00,Mining rig 1660 super,There are 6 graphic cards attached. It is still in good condition. Original boxes available so can pack each part individually. Sorry price in non-negotiable. Second pic is some thing do with you setting if you are familiar something do with over clo
1424534965,220126 1730,220128 1332,725.00,725.00,CUSTOM BUILT Gaming PC Ryzen 5 3600 / 16gb Ram / Nvidia GTX 1660 Ti / SSD + HDD Windows 10 Desktop,FOR SALE: - Here we have a very nice and capable 1080p/1440p Gaming PC running a Ryzen 5 3600 CPU combined with a Nvidia GTX 1660ti graphics Card. This system has been built on a Gigabyte Gaming X570 Motherboard using an EVGA G3 750W 80+ Gold PSU gi
1424516082,220126 1730,220203 1827,320.00,300.00,"Gaming PC, efficient, GTX 1660 Super","GTX 1660 Super 6GB Ivybridge i3 8GB RAM 160GB HDD Windows 10 Professional 430W PSU Small, efficient, clean. All relatively modern, especially the graphics card which is what makes it a gaming PC. The case is only average, it's compact. But"
1424471285,220126 1730,220425 1527,1100.00,1000.00,Pre Built Pc 1660 super with bundles,"MSI 1660 super pre built pc with 32 gb rgb rams. Samsung 165hz monitor / msi rgb keyboard and mouse ( rgb not working ) / astro a 40 with mix amp 4th gen ( like new, only used for 2 month / 2x scuf controller with digital trigger ( used works fine )"
1424416663,220125 1730,220209 1226,630.00,590.00,"i5 7400, GTX 1660, 16GB RAM, SSD and HDD Desktop Gaming Pc",CPU: Intel i5 7400 GPU: Nvidia GeForce Asus Phoenix GTX 1660 6G OC MOTHERBOARD: Gigabyte GA-H110m-S2H RAM: Crucial 16Gb DDR4 2133MHz Dual Channel PSU: Corsair CX 600W COOLER: Liquid Cooler 120mm Cooler Master Seidon 120V ST
1424337702,220124 1730,220211 2335,495.00,495.00,MSI Trident 3 Gaming Pc GTX 1660,Fully boxed with all original packaging Graphics card alone is selling for £300 second hand Windows 10 Intel core i5-9400F 2.90 ghz Nvidia GeForce GTX 1660 Super 16 GB RAM 256gb ssd Reason for sale - new pc arriving on 24/01
1424321077,220124 1730,220202 0924,750.00,750.00,"Brand New i5-9400F Gaming PC - GTX 1660 6GB, 16GB DDR4, 500GB M.2 NVMe SSD, RGB lighting",All parts BRAND NEW! The PC comes boxed with FULL 1 YEAR WARRANTY! Free delivery available! Latest model really expensive GeForce GTX 1660 gaming graphics card! This PC will be freshly build just after you place an order typically for next
1424263000,220123 1730,220202 0924,850.00,850.00,"High Spec Gaming PC: Core i5-9600K, GTX 1660 6GB, 1.25TB SSD/HDD, 16GB RAM, RGB Lighting","Brand new in the box with full 1 year warranty one of the latest Coffee Lake generation top 6-Core Unlocked Intel i5 CPU High End Gaming PC - ready for 4K, VR, editing, streaming, support for the latest RAY TRACING technology - Window"
1424261482,220123 1730,220404 1138,900.00,780.00,"9th gen Intel Gaming PC, GTX 1660 Super, 16gb DDR4, NVME",Gaming PC NZXT H510 white with tempered Glass front and Side panel Intel 9400f CPU 6 cores 6 Threads 2.9-4.1 GHz Corsair H100i 240mm liquid cooler with box Gigabyte z370p D3 motherboard 6 x 120mm ARGB fans with remote control 256GB Samsung m2 NVME d
1424261445,220123 1730,220210 1844,850.00,850.00,"Ryzen Gaming PC, 3500X, GTX 1660, 16gb DDR4, NVME",Gaming PC NZXT H510 -Black Tempered Side panel (with box) Ryzen 5 3500x CPU 3.6 - 4.1GHz Cooler Master 240mm liquid CPU Cooler 2 X RGB led strips with motherboard control 2 x 120mm NZXT extract fans MSI B450 Tomahawk Motherboard 256GB NVME M.2 SSD
1424199621,220122 1730,220128 1332,625.00,625.00,"Gaming PC - gtx 1660 super 6gb, ryzen 5 1600, 16gb ram, 1tb nvme ssd, windows 10","Windows 10 gaming PC in good condition, working perfectly except the audio from the motherboard doesn't sound correct, so I've been using audio via my monitor which sounds good. With a new nvme ssd drive, new power supply and new case. Graphics c"
1424172000,220122 1730,220130 1453,3000.00,3000.00,6 x 1660 super Mining rig,"6 x 1660 super mining rigs , uses slightly over 500w, roughly 180mh/s is in good condition. Can deliver if local to Bradford/Leeds."
1424006663,220126 1730,220311 0855,850.00,750.00,FULL Gaming Pc Setup | i5-10400f - GTX 1660 SUPER | 16GB RAM,Pickup £850 Drop off: will get a quote Moving house by the end of January so will change postcode if needed MONITOR HAS TWO MINOR SCRATCHES this hasn’t damaged the monitor in any way however is visible and might not be applicable for yourse
1423936028,220119 1730,220119 1730,800.00,800.00,Gaming PC - i5 9600k - 1660 SUPER Ultra Gaming - 32 GB Ram,"I am selling my gaming pc which I built myself 18 months ago using quality parts. This pc can play any game on high settings at 1440p @ 60fps (Warzone, Cyberpunk), plus any games at 1080p 100fps+. Easily overclockable with the 9600k. Insanely fast lo"
1423882161,220118 1730,220204 2348,575.00,550.00,Gaming PC - GTX 1660 Ti 6GB - i5 6400 - Desktop,Gaming PC - GTX 1660 Ti 6GB - i5 6400 - Desktop THIS LISTING IS FOR THE PC TOWER ONLY. Can arrange a deal to include a mouse/keyboard/monitor if required for a full starter setup. 1080p Gaming capable PC. Will play all latest game titles @ 60F
1423807399,220117 1730,220203 1827,300.00,300.00,Gtx 1660 super,"In perfect condition Message arbour any questions Gtx 1660 super . Posted by Isaac in Computers, Laptops & Netbooks, Desktop & Workstation PCs in West Wickham. 17 January 2022"
1423772922,220117 1730,220202 0924,650.00,650.00,MSI Gaming PC - GTX Super 1660 - 8GB RAM,"Gaming PC - 8GB Ram - GTX Super 1660. Like new in brand new condition, still got the plastic on it. Selling due to lack of use. Comes with original box. Bought for £900 last year. Collection Only. S63. £650 ONO"
1423699849,220116 1730,220202 0924,800.00,800.00,"GAMING PC - RYZEN 5 2600, NVIDIA GEFORCE GTX 1660 TI, 16GB OF RAM",CPU: AMD Ryzen 5 2600 (6 Core Processor) GPU: NVIDIA GeForce GTX 1660 Ti 6GB RAM: 16GB (8GB x 2) G Skill Trident Z RGB DDR4 3200MHz SSD: Kingston A400 SATA Internal SSD - 500GB + Samsung 860 EVO SATA Internal SSD - 1TB PSU: Corsair VS Series VS65
1423563965,220114 1730,220224 0818,875.00,875.00,"Gaming Computer PC Setup Complete Bundle (intel i5 9th, 16GB RAM, 240GB SSD, GTX 1660)",Specifications: Processor: Intel i5 9400f 2.9GHz RAM: 16GB DDR4 Storage: 240GB SSD Graphics: GTX 1660 6GB Power: Thermaltake 700 Watt OS: Windows 10 64 Bit Included: PC Tower 22 inch Monitor (model may vary) Gaming Lightup Mouse (model m
1421761670,220115 1730,220202 0924,400.00,400.00,I7 gaming pc gtx 1660 liquid cooled,"Hello, selling my pc that i have had for a few years has always been looked after when used. selling due to lack of use and could use the money for Christmas. The case is Thermaltake View 37 with 7 rgb lights all togeather with corsair rgb co"
1421679326,220117 1730,220228 0908,815.00,815.00,"Gaming Computer PC (intel i5 9th Gen, 16GB RAM, 240GB SSD, GTX 1660)",Specifications: Processor: Intel i5 9400F 2.9-4.1GHz RAM: 16GB DDR4 Storage: 250GB SSD Graphics: GTX 1660 6GB Nvidia Geforce OS: Windows 10 64 Bit Included: - PC Tower - Kettle Lead Add £15 for a wifi dongle ___________________________
1421518942,220123 1730,220130 1453,750.00,750.00,Gaming pc 1660 TI/ I5 9400F,Gaming Pc description: I have owned this pc for around 2 years now all parts are working Like new and have never been pushed passed there limits reason for selling as recently upgraded Comes with built in PCIE Wifi Card for your convenience and eas
1421422682,220117 1730,220425 1527,825.00,825.00,"HP Gaming Computer PC (Intel i5 9th, 8GB RAM, 250GB SSD, 2TB, GTX 1660)",Specifications: Processor: Intel i5 9400f 2.9-4.1GHz RAM: 8GB DDR4 Storage: 250GB SSD + 2TB HDD Graphics: GTX 1660 6GB Nvidia Geforce Case: HP OS: Windows 10 64 Bit Refurbished Grade A with Box Add £15 for a wifi dongle _______________
1421301030,220123 1730,220204 2348,2700.00,2600.00,5 x 1660 TI / Mining Rig / Mining computer / 150+ MH/s,"Here is my 1660 TI mining rig. Its build to use the least amount of power without losing any MH/s and pulling in maximum profit, it's a lovely mining rig with nothing at all wrong with it and even comes with spare risers and other bits Everything"
1421132197,220118 1730,220405 2316,111.00,100.00,"Wanted gtx 1050 , 1650 , 1660 , 1070 , 2060 , 3060 and similar",Hi looking one of those cards for reasonable price let me know
1423547549,220114 1332,220224 0818,849.00,849.00,"HP Omen 25L Gaming Computer PC (Intel i5 10th, 8GB RAM, GTX 1660 Ti)",Specifications: Processor: Intel i5 10400 2.9GHz RAM: 8GB DDR4 Storage: 250GB SSD + 2TB HDD Graphics: GTX 1660 Ti 6GB Nvidia Geforce Case: HP 25L OS: Windows 10 64 Bit Follow TP Computers On Facebook ⭐⭐⭐⭐⭐ We have been on the market an
1424787690,220130 0950,220130 0950,275.00,275.00,ULTRA FAST i7 Desktop Gaming Computer PC 1TB 16GB RAM GTX 1660 Windows 10,ULTRA FAST i7 Desktop Gaming Computer PC 1TB 16GB RAM GTX 1660 Windows 10 wife prefers her tablet £275 ono
1424754638,220129 1648,220202 0924,625.00,625.00,"Gaming PC - gtx 1660 super 6gb, ryzen 5 1600, 16gb ram, 1tb nvme ssd, windows 10","Windows 10 gaming PC in good condition, working perfectly except the audio from the motherboard doesn't sound correct, so I've been using audio via my monitor which sounds good. With a new nvme ssd drive, new power supply and new case. Graphics c"
1424725284,220129 1453,220129 1453,725.00,725.00,CUSTOM BUILT Gaming PC Ryzen 5 3600 / 16gb Ram / Nvidia GTX 1660 Ti / SSD + HDD Windows 10 Desktop,FOR SALE: - Here we have a very nice and capable 1080p/1440p Gaming PC running a Ryzen 5 3600 CPU combined with a Nvidia GTX 1660ti graphics Card. This system has been built on a Gigabyte Gaming X570 Motherboard using an EVGA G3 750W 80+ Gold PSU giv
1424597262,220127 1453,220225 1223,350.00,350.00,Acer Aspire XC-1660 Desk top Computer complete with wireless keyboard/mouse unused,"PLEASE NOTE MISTAKE WAS MADE WITH ORIGINAL MODEL AND SPECS - PRICE REMAINS THE SAME. Do you need a mini desktop computer to work from home, if so this one could be ideal for you. COMPUTER SPECIFICATIONS AS FOLLOWS - Has been upgraded to Windows"
1424865458,220131 1111,220203 1827,750.00,700.00,"Desktop Gaming PC: Intel i3 Quad Core 3.6GHz, 16 GB RAM, 512 SSD, GTX 1660 Super","Decided to sell my gaming pc as i no longer have time to use it. This PC is amazing, runs all games at high FPS. Parts List: CPU: Intel core i3 10100f quad core 3.6GHz GPU: GTX 1660 Super RAM: 16g Corsair Motherboard: MSI Mag Mortor Cooler"
1399784270,220114 1404,220114 1404,1000.00,1000.00,Custom Gaming PC - GTX 1660 Super,"This is the latest build I have available. Just been recently built using all brand new parts. This PC build consists of intel’s latest 10th Generation processor, along with some great components to get you gaming straight away. The PC comes"
1420450046,220201 0924,220209 1226,850.00,549.00,Custom built PC with Gainward GeForce GTX 1660 TI 6gb Ghost,Custom built PC which was built by CCL Computers for emulation. Brand new. Only removed from box to take photos. Reluctant sale due to personal reasons. Genuine sale. PC specs: Processor - AMD Ryzen 5 3600 (3.6ghz Hexa Core) Memory - Adata XPG Gam
1424912216,220201 0924,220302 0016,599.00,499.00,Gaming PC- Intel i5 10400F 1TB+ 480GB Ssd 16GB RAM GTX 1660 win10 11 months old immaculate,"Bought in lockdown, used twice , immaculate with original box , cost £799"
1425106395,220203 1729,220210 1844,850.00,850.00,"High Spec Gaming PC: Core i5-9600K, GTX 1660 6GB, 1.25TB SSD/HDD, 16GB RAM, RGB Lighting","Brand new in the box with full 1 year warranty one of the latest Coffee Lake generation top 6-Core Unlocked Intel i5 CPU High End Gaming PC - ready for 4K, VR, editing, streaming, support for the latest RAY TRACING technology - Window"
1425093368,220203 1422,220224 0818,850.00,850.00,"Gaming Computer PC Setup - Intel i5 9600, 16GB RAM, 500GB SSD, 1TB HDD, GTX 1660",Specifications: Processor: Intel i5 9600 3.1GHz RAM: 16GB DDR4 Corsair Vengeance Storage: 500GB SSD + 1TB HDD Graphics: GTX 1660 6GB Power: 500 Watt Case: Fusion OS: Windows 10 64 Bit Included: PC Tower 22 inch Monitor (model may vary) G
1422342395,220203 0919,220214 1803,250.00,250.00,ASUS GTX 1660 Super for sale- not overclocked,"Recently upgraded to another Graphics Card for Christmas, used this for less than a year. Works great on all games and a great entry card. Never been overclocked."
1425062036,220202 2329,220216 2342,650.00,650.00,"Gaming PC - Ryzen 6-core, Liquid Cooled, GTX 1660, RGB RAM, 1TB M.2",• AMD Ryzen 5 1600 Six-Core Processor @ 3.4GHz • Deepcool Castle 360 Liquid Cooling (NEW) • MSI B350 Tomahawk Arctic Edition Motherboard • 16GB Corsair Vengeance RGB RAM @3000MHz • 1TB Western Digital Blue M.2 NVMe SSD (NEW) • Zotac GeForce GTX
1425054800,220202 2022,220204 2348,530.00,530.00,"Gaming PC - GTX 1660 Super, Intel i7-4770, 16gb ram, SSD, Windows 10","Windows 10 gaming PC, works perfectly. GPU : Evga SC Ultra GTX 1660 Super 6gb CPU : Intel Core i7-4770 with 4 cores & 8 threads, running at 3.4GHz, up to 3.9GHz turbo automatically Motherboard : Gigabyte H81M-DS2V Memory : 16gb of Crucial 1600m"
1425043714,220202 1827,220303 2248,799.00,799.00,AMD RYZEN 5 1600 6-CORE 3.6GHz & Nvidia GTX 1660 6GB,We are GSC Computers Northern Ireland's Number One Independent Custom PC Retailer 🚚 EXPRESS UK & IRELAND DELIVERY This system is already built and good to go (No Import Fees to Ireland) 🚚 Finance options available via our website System
1425041973,220202 1827,220205 1333,120.00,120.00,GTX 1660 Super,"Has been used but is in really good condition, Can post at the buyers cost. Let me know if you have any questions, thanks."
1425041315,220202 1827,220208 1440,750.00,750.00,"Brand New i5-9400F Gaming PC - GTX 1660 6GB, 16GB DDR4, 500GB M.2 NVMe SSD, RGB lighting",All parts BRAND NEW! The PC comes boxed with FULL 1 YEAR WARRANTY! Free delivery available! Latest model really expensive GeForce GTX 1660 gaming graphics card! This PC will be freshly build just after you place an order typically for next
1425194879,220204 1943,220205 1333,899.00,899.00,BARGAIN GAMING PC i7 10700F RAM16GB GTX 1660 TI SSD512GB VR DESKTOP COMPUTER WORKSTATION,Connect via hdmi with any screen tv monitor or projector. JUST PLUG AND PLAY STRAIGHT AWAY Type Gaming PC Workstation Desktop Server Computer Vr desktop computer can be used as Capable workstation or server machine JUST PLUG AND PLAY STRAIGHT AW
1425180468,220204 1650,220304 1845,869.00,869.00,AMD Ryzen 5 3600 3.6GHz 6-Core & GTX 1660 6GB,We are GSC Computers Northern Ireland's Number One Independent Custom PC Retailer 🚚 EXPRESS UK & IRELAND DELIVERY This system is already built and good to go (No Import Fees to Ireland) 🚚 Finance options available via our website System
1425177530,220204 1552,220304 1845,8000.00,8000.00,487mh Eth mining rig 16 x 1660 super,"487 mh 16 GPU mining rig which consists of 2 x 8 GPU rigs (16 GPU total). Running on HiveOS Each rig motherboard has capacity of 13 GPUs, so you could add up to 26 GPUs total for future expansion. Rig includes: 3 x Veddha 8 GPU rig frames 16 x 1660"
1425125396,220203 2348,220216 2342,750.00,600.00,Gaming Pc GTX 1660 super with gaming monitor,"Decided to sell my gaming pc as i no longer have time to use it. This PC is amazing, runs all games at high FPS. Parts List: CPU: Intel core i3 10100f quad core 3.6GHz GPU: GTX 1660 Super RAM: 16g Corsair Motherboard: MSI Mag Mortor Cooler"
1425229511,220205 1137,220306 1745,750.00,650.00,HP Omen 25L Gaming PC - Intel core i5 GTX 1660 2TB GDD and 256 SSD,"Hi, I am selling my HP Omen Gaming PC. See specs below: Key Features 10th generation Intel® Core™ i5 processor Blast through latest games with the HP OMEN 25L Gaming PC. Equipped with a 10th generation Intel® Core™ i5 processor, you have six-cor"
1425222269,220205 1040,220207 2303,530.00,530.00,"Gaming PC - GTX 1660 Super, Intel i7-4770, 16gb ram, SSD, Windows 10","Windows 10 gaming PC, works perfectly, with some new parts (new SSD and new power supply). GPU : Evga SC Ultra GTX 1660 Super 6gb CPU : Intel Core i7-4770 with 4 cores & 8 threads, running at 3.4GHz, up to 3.9GHz turbo automatically Motherboard"
1425219126,220205 1040,220210 1844,500.00,450.00,Acre Aspire TC-1660 Desktop Pc,Intel core i7-11700 Fast processer Total Cores 8 Total Threads 16 Processor base 2.50 GHz Max turbo frequency 4.90 GHz Cache 16 MB Intel Intel UHD Graphics 750 16GB DDR4 Memory 2TB HardDrive 500 GB Samsung 980 M.2 Running windows 11 27” Samsung Mon
1418872920,220205 0635,220710 1034,1250.00,1250.00,HP Z420 CAD Computer + Intel Xeon E5-1660 V2 + 128gb Ram + 1TB SSD + 8GB Quadro,"When it comes to CAD computers, it is hard to get it right at a good price unless you know what you are doing. IT technicians will go straight by the book and suggest the latest expensive machine on the market, however Design Engineers will will tell"
1425205727,220205 0133,220206 1834,600.00,600.00,FULL GAMING PC SETUP BUNDLE GTX 1660 Ryzen 7 16GB RAM Logitech g920,Selling this racing sim pc setup as I don’t have time for it anymore . Pc works flawlessly boots up in seconds and plays anything you throw at it. CPU: AMD Ryzen 7 2700X Processor Eight cores with Wraith Prism RGB LED Cooler. Same performance as i7
1425319019,220206 1429,220206 1429,899.00,899.00,BARGAIN GAMING PC i7 10700F RAM16GB GTX 1660 TI SSD512GB VR DESKTOP COMPUTER WORKSTATION,Connect via hdmi with any screen tv monitor or projector. JUST PLUG AND PLAY STRAIGHT AWAY Type Gaming PC Workstation Desktop Server Computer Vr desktop computer can be used as Capable workstation or server machine JUST PLUG AND PLAY STRAIGHT AW
1422800426,220206 1331,220405 2316,850.00,850.00,Full Setup Corsair Ryzen 5 Gaming PC GTX 1660 PC 12 Months Warranty,"New Build 2022 12 months warranty Specifications: - Monitor: - Asus Gaming 24"" 1080p (1920 x 1080) - Processor: - RYZEN 5 SIX CORE 2600 3.90GHZ - 6 Cores, 12 Threads - Wraith Prism Cooler - Ram memory: - 16GB Corsair vengeance lpx - Motherboar"
1425315419,220206 1331,220311 0855,800.00,750.00,Full Gaming Pc Setup | i5-10400f x 1660 super | 16GB RAM | Windows 11,Pickup £800 Drop off: will get a quote MONITOR HAS TWO MINOR SCRATCHES this hasn’t damaged the monitor in any way and is barely visible and might not be applicable for yourselves (When gaming it is barely visible) FULL Gaming Pc Setup
1425401327,220207 1605,220207 1605,899.00,899.00,BARGAIN GAMING PC i7 10700F RAM16GB GTX 1660 TI SSD512GB VR DESKTOP COMPUTER WORKSTATION,Connect via hdmi with any screen tv monitor or projector. JUST PLUG AND PLAY STRAIGHT AWAY Type Gaming PC Workstation Desktop Server Computer Vr desktop computer can be used as Capable workstation or server machine JUST PLUG AND PLAY STRAIGHT AW
1425397375,220207 1507,220209 1226,700.00,700.00,CUSTOM BUILT Gaming PC Ryzen 5 3600 / 16gb Ram / Nvidia GTX 1660 Ti / SSD + HDD Windows 10 Desktop,FOR SALE: - Here we have a very nice and capable 1080p/1440p Gaming PC running a Ryzen 5 3600 CPU combined with a Nvidia GTX 1660ti graphics Card. This system has been built on a Gigabyte Gaming X570 Motherboard using an EVGA G3 750W 80+ Gold PSU giv
1425360676,220207 0000,220306 1745,1219.00,900.00,"Gaming PC - Intel i5 10400F, 1660 Super, 16GB DDR4, 1TB HDD, 240GB SSD and Gaming Monitor - 240Hz","Selling this beast of a PC. Sad to see it go, but need to move on from gaming. It will come with Windows 11 installed and activated. I am also selling with it an Alienware monitor, with adjustable heights, 240 Hz, 1ms, G-SYNC compatible. I can al"
1425457059,220208 1244,220209 1226,899.00,899.00,BARGAIN GAMING PC i7 10700F RAM16GB GTX 1660 TI SSD512GB VR DESKTOP COMPUTER WORKSTATION,Connect via hdmi with any screen tv monitor or projector. JUST PLUG AND PLAY STRAIGHT AWAY Type Gaming PC Workstation Desktop Server Computer Vr desktop computer can be used as Capable workstation or server machine JUST PLUG AND PLAY STRAIGHT AW
1425489163,220208 1923,220308 1606,700.00,700.00,Gaming PC with 1660 super and Gaming monitor 144HZ,"650 lowest price AOC Gaming 24G2U -24 Inch FHD Monitor, 144Hz, 1ms, IPS, AMD FreeSync, Height Adjust, Speakers, USB Hub, Low Input Lag (1920x1080 @ 144Hz, 250cd/m², HDMI/DP/VGA/USB 3.0) PC SPEC CA-02N-KK Kolink Core Series 500W 80 Plus Certi"
1425475014,220208 1630,220211 2335,750.00,750.00,"Brand New i5-9400 Gaming PC - GTX 1660 6GB, 16GB RAM, 500GB M.2 NVMe SSD, RGB lighting",All parts BRAND NEW! The PC comes boxed with FULL 1 YEAR WARRANTY! Free delivery available! Latest model really expensive GeForce GTX 1660 gaming graphics card! This PC will be freshly build just after you place an order typically for next
1425597834,220210 1244,220210 1244,899.00,899.00,BARGAIN GAMING PC i7 10700F RAM16GB GTX 1660 TI SSD512GB VR DESKTOP COMPUTER WORKSTATION,Connect via hdmi with any screen tv monitor or projector. JUST PLUG AND PLAY STRAIGHT AWAY Type Gaming PC Workstation Desktop Server Computer Vr desktop computer can be used as Capable workstation or server machine JUST PLUG AND PLAY STRAIGHT AW
1425537499,220209 1844,220302 0016,699.99,699.99,Gaming PC - Ryzen 5 3600XT / GTX 1660 SUPER / 16GB DDR4 / 1.5TB + More,AMD Ryzen 5 3600XT CPU AMD Wraith Stealth CPU Cooler Gigabyte AORUS B450 Elite Motherboard WiFi + Bluetooth Card (160 + 50 + 15 = 225) Gigabyte GeForce GTX 1660 SUPER Gaming OC - 6GB GDDR6 GPU (350) 16GB (2 x 8GB) Corsair Vengeance LPX DDR4 RAM (50
1425695263,220211 1637,220215 2317,770.00,770.00,"High Spec Gaming PC: Core i5-9600K, GTX 1660 6GB, 1.25TB SSD/HDD, 16GB RAM, RGB Lighting","Brand new in the box with full 1 year warranty one of the latest Coffee Lake generation top 6-Core Unlocked Intel i5 CPU High End Gaming PC - ready for 4K, VR, editing, streaming, support for the latest RAY TRACING technology - Window"
1425669198,220211 1135,220211 1135,899.00,899.00,BARGAIN GAMING PC i7 10700F RAM16GB GTX 1660 TI SSD512GB VR DESKTOP COMPUTER WORKSTATION,Connect via hdmi with any screen tv monitor or projector. JUST PLUG AND PLAY STRAIGHT AWAY Type Gaming PC Workstation Desktop Server Computer Vr desktop computer can be used as Capable workstation or server machine JUST PLUG AND PLAY STRAIGHT AW
1425648841,220211 0730,220215 2317,540.00,540.00,"GTX 1660 GPU, Intel i5 9th Gen, 16GB, Nvme SSD and HDD Desktop Gaming Pc",CPU: Intel i5 9400F GPU: Nvidia GeForce GTX Asus 1660 6GB MOTHERBOARD: Gigabyte H310M RAM: Samsung 16GB (2x8GB) DDR4 2666MHz Dual Channel PSU: Artic Blue+ 750W COOLER: Intel Stock New Design STORAGE 1: 512GB Nvme m.2 SSD WD STORAGE 2: HDD 100
1425641384,220211 0227,220228 0908,700.00,640.00,Ryzen 7 GTX 1660 Super Gaming PC,Powerful gaming and editing PC made from a mixture of new and used components in excellent condition. Specs: CPU - AMD Ryzen 7 2700x 8 core 16T CPU Cooler - AMD Wraith Prism RGB Motherboard - Gigabyte B450m DS3H RAM - 24GB Corsair Vengeance 1x16
1425635994,220210 2335,220226 2340,350.00,350.00,GeForce GTX 1660 Super For Sale,For Sale Geforce GTX 1660 Super gaming x graphics card. Bought about a year ago but now upgraded so no longer in use. Works perfectly as it should. Slight scratch on the backplate which happened when removing. See photo. £350 ono
1425836287,220213 1423,220213 1423,899.00,899.00,BARGAIN GAMING PC i7 10700F RAM16GB GTX 1660 TI SSD512GB VR DESKTOP COMPUTER WORKSTATION,Connect via hdmi with any screen tv monitor or projector. JUST PLUG AND PLAY STRAIGHT AWAY Type Gaming PC Workstation Desktop Server Computer Vr desktop computer can be used as Capable workstation or server machine JUST PLUG AND PLAY STRAIGHT AW
1425826085,220213 1326,220216 2342,730.00,730.00,"Brand New i5-9400 Gaming PC - GTX 1660 6GB, 16GB RAM, 500GB M.2 NVMe SSD, RGB lighting",All parts BRAND NEW! The PC comes boxed with FULL 1 YEAR WARRANTY! Free delivery available! Latest model really expensive GeForce GTX 1660 gaming graphics card! This PC will be freshly build just after you place an order typically for next
1425761286,220212 1926,220216 2342,450.00,450.00,😈 Core i7 Gaming PC - GTX 1660 Super Graphics - 16GB 😈,"For sale is a fantastic gaming PC, which is fully boxed and in a new condition! The system is capable of playing all the latest games with ease, with high detail settings! Includes a brand new and sealed Gaming Peripheral set, RGB Keyboard, RGB"
1425906603,220214 1358,220214 1358,899.00,899.00,BARGAIN GAMING PC i7 10700F RAM16GB GTX 1660 TI SSD512GB VR DESKTOP COMPUTER WORKSTATION,Connect via hdmi with any screen tv monitor or projector. JUST PLUG AND PLAY STRAIGHT AWAY Type Gaming PC Workstation Desktop Server Computer Vr desktop computer can be used as Capable workstation or server machine JUST PLUG AND PLAY STRAIGHT AW
1425893406,220214 1203,220311 0855,650.00,525.00,Gaming Pc with 1660 Super,This is a micro ATX pc. The processor is a AMD Ryzen 5 3600 and the motherboard is a B450M Mortar Max. It has 16GBs od Ram. The SSD Is 225gb and the HDD is 2TB. The graphics card is a MSI Nvidia Geforxe GTX 1660 super gaming x. The pc is a bit dust
1425885111,220214 1007,220214 1007,650.00,650.00,Gaming PC 1660 Super,This is a micro ATX pc. The processor is a AMD Ryzen 5 3600 and the motherboard is a B450M Mortar Max. It has 16GBs od Ram. The SSD Is 225gb and the HDD is 2TB. The graphics card is a MSI Nvidia Geforxe GTX 1660 super gaming x. The pc is a bit du
1425994950,220215 1814,220316 0950,625.00,625.00,Acer Nitro Gaming Computer PC | Intel i5 | 8GB DDR4 | GTX 1660 SUPER,Specifications: Processor: Intel i5 10400 2.9GHz 6 Core RAM: 8GB DDR4 Storage: 256 M.2 + 1TB HDD Graphics: GTX 1660 Super 6GB Case: Acer Nitro OS: Windows 10 64 Bit Add £15 for a wifi dongle ________________________________ Follow TP Comp
